No,Category,Guideline,指导方针,Description,描述,Do,推荐做法,Don't,不推荐做法,Code Good,良好代码,Code Bad,不良代码,Severity,Docs URL
51,插件 | Plugins,Use .client or .server suffix,使用 .client 或 .server 后缀,Control plugin execution environment,控制插件执行环境,plugin.client.ts for client-only,仅客户端使用 plugin.client.ts,if (process.client) checks,使用 if (process.client) 检查,analytics.client.ts,analytics.client.ts,"if (process.client) { // analytics }","if (process.client) { // analytics }",中等 | Medium,https://nuxt.com/docs/guide/directory-structure/plugins
52,环境 | Environment,Use runtimeConfig for env vars,环境变量使用 runtimeConfig,Access environment variables safely,安全访问环境变量,runtimeConfig in nuxt.config,在 nuxt.config 中使用 runtimeConfig,process.env directly,直接使用 process.env,"runtimeConfig: { apiSecret: '', public: { apiBase: '' } }","runtimeConfig: { apiSecret: '', public: { apiBase: '' } }",process.env.API_SECRET in components,组件中使用 process.env.API_SECRET,高 | High,https://nuxt.com/docs/guide/going-further/runtime-config
53,环境 | Environment,Use NUXT_ prefix for env override,环境覆盖使用 NUXT_ 前缀,Override config with environment variables,使用环境变量覆盖配置,NUXT_API_SECRET NUXT_PUBLIC_API_BASE,使用 NUXT_API_SECRET NUXT_PUBLIC_API_BASE,Custom env var names,自定义环境变量名,NUXT_PUBLIC_API_BASE=https://api.example.com,NUXT_PUBLIC_API_BASE=https://api.example.com,API_BASE=https://api.example.com,API_BASE=https://api.example.com,高 | High,https://nuxt.com/docs/guide/going-further/runtime-config
54,环境 | Environment,Access public config with useRuntimeConfig,访问公共配置使用 useRuntimeConfig,Get public config in components,在组件中获取公共配置,useRuntimeConfig().public,使用 useRuntimeConfig().public,Direct process.env access,直接访问 process.env,const config = useRuntimeConfig(); config.public.apiBase,const config = useRuntimeConfig(); config.public.apiBase,process.env.NUXT_PUBLIC_API_BASE,process.env.NUXT_PUBLIC_API_BASE,高 | High,https://nuxt.com/docs/api/composables/use-runtime-config
55,环境 | Environment,Keep secrets in private config,私有配置保存密钥,Server-only secrets in runtimeConfig root,runtimeConfig 根级别的服务端密钥,runtimeConfig.apiSecret (server only),runtimeConfig.apiSecret (仅服务端),Secrets in public config,公共配置中的密钥,runtimeConfig: { dbPassword: '' },runtimeConfig: { dbPassword: '' },"runtimeConfig: { public: { dbPassword: '' } }","runtimeConfig: { public: { dbPassword: '' } }",高 | High,https://nuxt.com/docs/guide/going-further/runtime-config
56,性能 | Performance,Use Lazy prefix for code splitting,代码分割使用 Lazy 前缀,Lazy load components with Lazy prefix,使用 Lazy 前缀懒加载组件,<LazyComponent> for below-fold,折叠下方使用 <LazyComponent>,Eager load all components,急切加载所有组件,<LazyMountainsList v-if="show"/>,<LazyMountainsList v-if="show"/>,<MountainsList/> for hidden content,隐藏内容使用 <MountainsList/>,中等 | Medium,https://nuxt.com/docs/guide/directory-structure/components
57,性能 | Performance,Use useLazyFetch for non-blocking data,非阻塞数据使用 useLazyFetch,Alias for useFetch with lazy: true,useFetch 的 lazy: true 别名,useLazyFetch for secondary data,二级数据使用 useLazyFetch,useFetch for all requests,所有请求使用 useFetch,"const { data } = useLazyFetch('/api/comments')","const { data } = useLazyFetch('/api/comments')",await useFetch for comments section,评论区使用 await useFetch,中等 | Medium,https://nuxt.com/docs/api/composables/use-lazy-fetch
58,性能 | Performance,Use lazy hydration for interactivity,交互使用懒水合,Delay component hydration until needed,延迟组件水合直到需要时,LazyComponent with hydration strategy,LazyComponent 使用水合策略,Immediate hydration for all,所有组件立即水合,<LazyModal hydrate-on-visible/>,<LazyModal hydrate-on-visible/>,<Modal/> in footer,页脚中的 <Modal/>,低 | Low,https://nuxt.com/docs/guide/going-further/experimental-features
